{
  "assumptions": [],
  "constituents": [
    {
      "constituent_id": "fecal_coliform",
      "notes": null,
      "role": "gating",
      "source_basis": "regulatory_default",
      "source_concentration": null,
      "use_governed_default": true
    },
    {
      "constituent_id": "nitrate_as_N",
      "notes": null,
      "role": "reference_only",
      "source_basis": "regulatory_default",
      "source_concentration": null,
      "use_governed_default": true
    }
  ],
  "evidence": [
    {
      "captured_date": null,
      "confidence": "medium",
      "database_id": null,
      "evidence_id": "ev_site_assumed",
      "notes": null,
      "provenance_class": "assumed",
      "regulatory_authority": null,
      "review_status": "accepted",
      "source_description": "Site hydraulics and geometry (engineering assumption)"
    },
    {
      "captured_date": null,
      "confidence": "high",
      "database_id": "clay_loam",
      "evidence_id": "ev_soil_db",
      "notes": null,
      "provenance_class": "database_derived",
      "regulatory_authority": null,
      "review_status": "accepted",
      "source_description": "Soil database entry clay_loam"
    },
    {
      "captured_date": null,
      "confidence": "medium",
      "database_id": null,
      "evidence_id": "ev_regulatory",
      "notes": null,
      "provenance_class": "regulatory_default",
      "regulatory_authority": "30 TAC Ch. 285 (OSSF rules)",
      "review_status": "accepted",
      "source_description": "Governed defaults / 30 TAC Ch. 285 (OSSF rules)"
    },
    {
      "captured_date": null,
      "confidence": "high",
      "database_id": null,
      "evidence_id": "ev_treatment_docs",
      "notes": null,
      "provenance_class": "documented",
      "regulatory_authority": null,
      "review_status": "accepted",
      "source_description": "Treatment and disinfection from design documents"
    }
  ],
  "field_bindings": [
    {
      "assumption_id": null,
      "database_id": null,
      "evidence_id": "ev_site_assumed",
      "field_path": "groundwater.hydraulic_gradient",
      "notes": null,
      "provenance_class": "assumed",
      "regulatory_authority": null,
      "review_status": "accepted"
    },
    {
      "assumption_id": null,
      "database_id": null,
      "evidence_id": "ev_site_assumed",
      "field_path": "groundwater.depth_to_groundwater_m",
      "notes": null,
      "provenance_class": "assumed",
      "regulatory_authority": null,
      "review_status": "accepted"
    },
    {
      "assumption_id": null,
      "database_id": "clay_loam",
      "evidence_id": "ev_soil_db",
      "field_path": "subsurface.soil_id",
      "notes": null,
      "provenance_class": "database_derived",
      "regulatory_authority": null,
      "review_status": "accepted"
    },
    {
      "assumption_id": null,
      "database_id": null,
      "evidence_id": "ev_treatment_docs",
      "field_path": "treatment.treatment_level",
      "notes": null,
      "provenance_class": "documented",
      "regulatory_authority": null,
      "review_status": "accepted"
    },
    {
      "assumption_id": null,
      "database_id": null,
      "evidence_id": "ev_treatment_docs",
      "field_path": "treatment.disinfection_status",
      "notes": null,
      "provenance_class": "documented",
      "regulatory_authority": null,
      "review_status": "accepted"
    },
    {
      "assumption_id": null,
      "database_id": null,
      "evidence_id": "ev_site_assumed",
      "field_path": "physics.dispersivity_method",
      "notes": null,
      "provenance_class": "assumed",
      "regulatory_authority": null,
      "review_status": "accepted"
    },
    {
      "assumption_id": null,
      "database_id": null,
      "evidence_id": "ev_site_assumed",
      "field_path": "receptors[well_onsite].distance_m",
      "notes": null,
      "provenance_class": "assumed",
      "regulatory_authority": null,
      "review_status": "accepted"
    },
    {
      "assumption_id": null,
      "database_id": null,
      "evidence_id": "ev_site_assumed",
      "field_path": "receptors[well_adjacent].distance_m",
      "notes": null,
      "provenance_class": "assumed",
      "regulatory_authority": null,
      "review_status": "accepted"
    },
    {
      "assumption_id": null,
      "database_id": null,
      "evidence_id": "ev_regulatory",
      "field_path": "constituents[fecal_coliform].use_governed_default",
      "notes": null,
      "provenance_class": "regulatory_default",
      "regulatory_authority": "30 TAC Ch. 285 (OSSF rules)",
      "review_status": "accepted"
    },
    {
      "assumption_id": null,
      "database_id": null,
      "evidence_id": "ev_regulatory",
      "field_path": "constituents[fecal_coliform].source_basis",
      "notes": null,
      "provenance_class": "regulatory_default",
      "regulatory_authority": "30 TAC Ch. 285 (OSSF rules)",
      "review_status": "accepted"
    }
  ],
  "groundwater": {
    "depth_to_groundwater_m": 4.5,
    "hydraulic_gradient": 0.01
  },
  "physics": {
    "dispersivity_method": "epa_ssg",
    "engine": "ogata_banks_1d"
  },
  "project": {
    "county": "County, State",
    "description": null,
    "engineer": "EOR, P.E.",
    "name": "Fixture Site",
    "regulatory_authority": "30 TAC Ch. 285 (OSSF rules)"
  },
  "receptors": [
    {
      "active": true,
      "display_name": "On-site private well",
      "distance_m": 30.5,
      "notes": null,
      "receptor_id": "well_onsite",
      "receptor_type": "private_well"
    },
    {
      "active": true,
      "display_name": "Adjacent well",
      "distance_m": 45.7,
      "notes": null,
      "receptor_id": "well_adjacent",
      "receptor_type": "private_well"
    }
  ],
  "regulatory_location": {
    "coastal_zone": false,
    "edwards_aquifer_contributing_zone": false,
    "edwards_aquifer_recharge_zone": false,
    "edwards_aquifer_transition_zone": false,
    "karst_terrain": false,
    "notes": null
  },
  "reporting": {
    "comparison_soil_ids": [],
    "notes": null
  },
  "schema_version": "ossf-site-case-1.1.0",
  "site_id": "PROCEED-001",
  "source": {
    "description": null,
    "design_flow_gpd": 360.0
  },
  "subsurface": {
    "soil_id": "clay_loam",
    "soil_thickness_m": 3.0
  },
  "treatment": {
    "disinfection_method": "chlorine",
    "disinfection_status": "disinfected",
    "notes": null,
    "treatment_level": "secondary"
  }
}
